"id_tweet","id_user","tweet"
"31774","369","Yuuk kita sama2 bantu Palu,Sigi dan Donggala hari Senin 15 Okt 18, kita donasi sambil nonton Dewa19. Sisihkan rezek… https://t.co/dbPw4xQA4P"
"31775","369","Sekarang tiap kali selfie gak usah takut hasilnya cuma muka semua, karena #VivoV11Pro udah punya layar luas 6.41 in… https://t.co/H4qJ0XghP8"
"31776","369","It is look stunning while gamming with my #VivoV11Pro Nebula Purple.
Apalagi dengan RAM 6 GB, gamming jadi makin la… https://t.co/QPJ1yUwSi0"
"31777","369","#VivoV11Pro siap memancarkan pesonamu dengan warna gradasi Nebula Purple yang dilengkapi inovasi terbaru Screen Tou… https://t.co/7fPmS7zwNq"
"31778","369","Experience new innovation from @vivo_indonesia, #VivoV11Pro with Screen Touch ID and Nebula Purple colors. Are you… https://t.co/ezAH82NrSg"
"31779","369","The new one is coming! #VivoV11Pro @vivo_indonesia https://t.co/9knyGXygZ2"
"31780","369","Final FIFA World Cup tinggal 1 hari lagi!!! @vivo_indonesia https://t.co/kAyL1dWYqP"
"31781","369","Happy banget, mulai hari ini #VivoV9 6 GB udah bisa pre-order. Go check https://t.co/hogdH3gYNM for more info. 
Ga… https://t.co/mOPelEFlx8"
"31782","369","Now we can enjoy our favourite FIFA Worldcup match everywhere using #VivoV9 with 6.3"" FHD+ FullView™ Display… https://t.co/M9mbj7n9Fa"
"31783","369","Be a productive person while waiting for breakfasting time. Always captured all my moment using #VivoV9TrueRed from… https://t.co/hZmLcEeQzy"
"31784","369","Me time ala gue ya main game, pakai #VivoV9TrueRed dengan 6.3"" FHD+ FullView™ Display main game jadi lebih leluasa… https://t.co/U35Ov9903A"
"31785","369","Ramadhan telah tiba..Maaf lahir batin ya...Selamat beribadah puasa. https://t.co/IK9xM8sZTl"
"31786","369","Don't be afraid to be different. Just be the real you with #VivoV9TrueRed from @vivo_indonesia https://t.co/3jHylBEXKN"
"31787","369","Be cool when using #VivoV9CoolBlue. Grab it fast at your favourite store right now! Because this item is Limited Ed… https://t.co/Bc1MLe8mHZ"
"31788","369","Aku penggemar Band Dewa19. Fans beraat. Tgl 4 Mei nonton DEWA19 ya.. https://t.co/QPDgympNGg"
"31789","369","Life is a challenge, kick it, I'm Cool Blue. Grab yours #VivoV9CoolBlue Limited Edition on https://t.co/2Bg0JeIKVQ… https://t.co/NHzW2oTRTE"
"31790","369","Explore your world wider with #VivoV9 6.3"" FHD+ FullView™ Display @vivo_indonesia https://t.co/UDMeuxsUeO"
"31791","369","Tadi malam kemegahan Borobudur menjadi saksi hadirnya VIVO V9#VivoV9 Perfect Shot Perfect View @vivo_indonesia https://t.co/mh8zCbmeFV"
"31792","369","Stay tuned for #VivoV9 Grand Launch at Borobudur. Expand your perfection with all new FullView™ Display… https://t.co/zP5GDcJq6e"
"31793","369","BESOK, #VivoV9 Grand Launch at Borobudur jam 8 malam live di 12 TV Nasional @vivo_indonesia https://t.co/juNPTECLgi"
"31794","369","Mau tau keseruan kita di
#VivoV9 Grand Launch at Borobudur?nonton ya 29032018, 8 pm LIVE di12 TV Nasional… https://t.co/ZnFvuBgCG8"
"31795","369","Be ready to get your Perfect Shot, Perfect view with #VivoV9 @vivo_indonesia https://t.co/yD79tmp50c"
"31796","369","Happy week end 
All"
"31797","369","Sunday is a happy day! Take a #SelfieSunday with my #VivoV7, 24MP Clearer Selfie Perfect Camera @vivo_indonesia https://t.co/eT22tidBbh"
"31798","369","Minggu kemarin nonton perform mereka,  memang legend!!! #dewa19reunion https://t.co/gChRiPj2tj"
"31799","369","BonCabe Level 30 Pedasnya Extreeem! Jadikan BonCabe sebagai penyelamat rasa apapun makanan favorit lo! @boncabe https://t.co/jpTEQrEQAi"
"31800","369","BonCabe bisa bikin rasa makanan enak secara instan! Udah tabur BonCabe hari ini, BonCabe Lovers? @boncabe https://t.co/ap4ty9P0fv"
"31801","369","Penyelamat rasa makanan kini berada di genggaman tangan. Makan apa aja, dimana aja dan kapan aja, lo harus selalu b… https://t.co/lnI6N2dMxy"
"31802","369","This is my resolution!Share yours with hashtag #PerfectResolution and grab the #VivoV7!Info: https://t.co/gHs8paPW5H https://t.co/roJ2Br8EkD"
"31803","369","Nggak cuma buat camilan, gue juga suka banget makan masakan Bunda pakai BonCabe! Sensasi pedasnya bikin makan makin… https://t.co/68Cu72tZMz"
"31804","369","New experience! Sehari jadi karyawan @vivo_indonesia..Rasanya?? Seru banget! Thank you guys.. https://t.co/DnR64H2UBQ"
"31805","369","Celebrate New Year moment with my #VivoV7,24 MP Clearer Selfie Perfect Camera@vivo_indonesia https://t.co/hLP06RrNh5"
"31806","369","Are you ready for 2018? Prepare your new year celebration tonight with BonCabe! @boncabe https://t.co/j3Fl7BKMWU"
"31807","369","@BonCabe terbuat dr cabe asli pilihan terbaik&amp;bermutu tinggi. Aman dikonsumsi krn melewati proses seleksi ketat, di… https://t.co/ugP492fh0N"
"31808","369","Bikin camilan popcorn lo makin pedas dan mantap pake BonCabe level 30! Rasain sensasi pedas extreemnya! @boncabe https://t.co/pqI7DExgPO"
"31809","369","Ujan-ujan gini enaknya taburin BonCabe level 30 ke makanan apa nih, BonCabe Lovers? @boncabe https://t.co/8QLaBIxnkv"
"31810","369","Cara asik makan cilok ala gue ya tinggal tabur BonCabe level 30! Rasa pedasnya Extreeem! @boncabe https://t.co/hNRp4aG0dC"
"31811","369","Fitur Game Mode di#VivoV7 ini ngebantu bgt saat kita lg focus dlm pertandingan.Main game jd makin seru… https://t.co/SbUrjnTzPo"
"31812","369","keseruan #VivosupriseDelivery bersama JD.id, Tokopedia,AkuLaku,https://t.co/mYjQXLqjRQ, Lazada.Nantikan Kejutan Lai… https://t.co/CQKt8VHgr0"
"31813","369","Lo penyuka BonCabe Level 10, rasa Original? Ini dia karakternya! Setuju nggak, BonCabe Lovers? @boncabe https://t.co/Vjx59Al20u"
"31814","369","Buat lo penyuka rasa pedas yang kalem, lo bisa cobain BonCabe level 10 rasa Original. Pas banget ditaburin di atas… https://t.co/dbueJPa30q"
"31815","369","Besok 25 Nov 17..yang di Jakarta, Bandung, Bogor dan sekitarnya, nonton DEWA19 yuuk...gw juga nonton lho... https://t.co/0bsilG6g1Z"
"31816","369","Congrat buat para pemenang #VivoSurpriseDelivery. Happy banget tadi bisa antar langsung #VivoV7 n ketemu ama kalian… https://t.co/TAMdBpnlG3"
"31817","369","Siapakah dia??  #Amanbehindthescene#bandlegend#musisilegend https://t.co/bL98ZgqdW4"
"31818","369","Saatnya jadi trendsetter dan tunjukkin aksi maksimal dengan #Sonic150R @welovehonda_id#honda #AksiTanpaBatas https://t.co/ilNPCzkfcJ"
"31819","369","#VivoV7  officially launched guys!Kalian para gamers pasti suka sama V7 ini. Cek perfectselfie.id buat tau info len… https://t.co/OzuYTSTi4U"
"31820","369","Bersiaplah untuk yg satu ini... Perfect banget!!! https://t.co/sLV9RM32rz"
"31821","369","Waktu Aku Kecil

https://t.co/vQctUOZ1Md"
"31822","369","Thank you Jogja.. #VivoV7PlusPerfectMomentTour https://t.co/w3MygJqdMF"
"31823","369","Jogja..hadir dan jgn lewatin hr ini ya#VivoV7PlusPerfectMomentTour, selain bnyk hadiah tiap beli #VivoV7Plus dan ad… https://t.co/q9LmaMeFJE"
"31824","369","Jgn lewatin sore ini di  Denpasar.. #VivoV7PlusPerfectMomentTour, krn selain byk hadiah tiap beli #VivoV7Plus, baka… https://t.co/YmPHQCA6b6"
"31825","369","Makan tahu bulat yang digoreng dadakan nggak bakalan nikmat kalo nggak pake BonCabe! Udah coba? @boncabe https://t.co/3UXw6898af"
"31826","369","Cup cup dek,  kakak Al sdh datang kan kemaren. Thank you Roxy Jakarta#VivoV7PlusPerfectMomentTour #VivoV7Plus https://t.co/5cjDrkzhSN"
"31827","369","ITC Roxy Mas luar biasa!happy to see you guys. #VivoV7PlusPerfectMomentTour @vivo_indonesia #VivoV7Plus https://t.co/hF94WZ639Y"
"31828","369","Jgn lewatin bsk di Jakarta #VivoV7PlusPerfectMomentTour, krn selain bnyk hadiah tiap beli #VivoV7Plus, ada gw juga… https://t.co/4MSR1Mxnk5"
"31829","369","https://t.co/sdvHUMp1VHÀD"
"31830","369","Cuma BonCabe level 30 yang bisa penuhi selera makan pedas gue! BonCabe level berapa yang paling lo suka? @boncabe https://t.co/ApyH2qiX36"
"31831","369","Thank you Samarinda! Tunggu aku di kota - kota selanjutnya bersama #VivoV7Plus @vivo_indonesia 24MP #ClearerSelfie… https://t.co/bKtevIo898"
"31832","369","Jgn lupa! Hr ini pk 20:00 Vivo V7+ Grand launch, di 9 TV Nasinal, 9 Digital Media Partner dan@vivo_indonesia offici… https://t.co/TdEzSHblVF"
"31833","369","Ini dia camilan favorit yang nggak bakal gue tolak; Tahu goreng bertabur BonCabe level 30 di atasnya. Pedasnya Extr… https://t.co/OVpa02dsfE"
"31834","369","4 HARI LAGI! Penasaran sama kecanggihan 24MP #ClearerSelfie #PerfectCamera dari @vivo_indonesia? Catat tanggalnya 2… https://t.co/qA4XCAQSbQ"
"31835","369","Makan ayam goreng yg dimasak pakai KOBE Tepung Kentucky SuperCripsy tuh ga cukup 1 deh! Renyah &amp; lezatnya bikin ket… https://t.co/mpf88q9lRz"
"31836","369","Makan ayam goreng yg dimasak pakai KOBE Tepung Kentucky SuperCripsy tuh ga cukup 1 deh! Renyah &amp; lezatnya bikin ket… https://t.co/iyUsl9qCxz"
"31837","369","https://t.co/HdFRWHN0Xg"
"31838","369","BESOK SENIN,,,?/"
"31839","369","SELAMAT HARI MINGGU ALLL,,,,,SUKSES SEMUA"
"31840","369","RT @AHMADDHANIPRAST: Kisah Kehidupan w/ @alkohler7 https://t.co/1I2rUQnmnj"
"31841","369","RT @MAIAsangJUARA: Happy Birthday 20th to @AlKohler7 .. Wish you always the best https://t.co/G1WJi0QVtb"
"31842","369","#BAPReps3 Balada Al &amp; @Prillybie akhirnya tayang &amp; kalian bisa tonton di https://t.co/aLsHgJnirW. Prilly mau ngomon… https://t.co/Ky8RRfkezc"
"31843","369","Penasaran sama kelanjutan webseries gw &amp; @PrillyBie? Nantikan #BAPReps3 Balada Al &amp; Prilly: Pengagum Rahasia besok!… https://t.co/c9Yyi2KQ6w"
"31844","369","Ini dia yang selalu dicari saat makanan sudah tersaji, BonCabe level 30 rasa Original! Extrem pedasnya, tak tertaha… https://t.co/MY3oa6s2An"
"31845","369","Make your sushi more tasty with BonCabe level 30! @boncabe https://t.co/4M8L6zFfTP"
"31846","369","BUAT SEMUA TEMEN2 GW...
SEMOGA PADA SEHAT SELALAU
BANYAK REZEKY.DAN BAHAGIA...
AMINNNNN"
"31847","369","Cuma KOBE Tepung Kentucky SuperCrispy yang renyahnya pasti dan rasanya pas di hati! Cek cara masaknya di website… https://t.co/eZu67ZzliO"
"31848","369","I posted a new video to Facebook https://t.co/GYAzXIWTPw"
"31849","369","'This is it! Kelanjutan webseries gw &amp; @PrillyBie#BAPReps2 ""Pahlawan Merah Putih"" Bisa tonton di https://t.co/oLZOjxbllg ! @vivo_indonesia"
"31850","369","Saksikan kelanjutan webseries gw &amp; @PrillyBie #BAPReps2 di social  media channel @vivo_indonesia besok ya! Sudah pe… https://t.co/uoClts9EUk"
"31851","369","Tahu... siapa yang di belakang gw.. https://t.co/viGu8EDol1"
"31852","369","Saudara Saudara gue...?

https://t.co/FoD2eFYFN6"
"31853","369","Saat Malam Minggu Sendirian...Gimana Rasanya ????"
"31854","369","Ini dia webseries gw bersama @vivo_indonesia, #BAPR Balada Al&amp;@PrillyBie Ep. 1:Dendam Si Preman.Saksikan di… https://t.co/EfnzdgsAGv"
"31855","369","Saksikan webseries terbaru gw dan @PrillyBie #BAPR Episode 1: Dendam Si Preman besok di social media channel… https://t.co/hRpk42f3RM"
"31856","369","BERAPA JUMLAH DAN APA NAMA FANS BASE GW...PINGIN SAY HELLO"
"31857","369","KU INGIN RASAKAN CINTA"
"31858","369","Cemburu"
"31859","369","Before After Telkom https://t.co/VxyI7y32m8 via @YouTube"
"31860","369","AKU KANGEN DAN AKU RINDU.??? https://t.co/92cgzT11TX"
"31861","369","RT @kiyaauulL: @AlKohler7 gapake rambut kalo bisa gapake pala dah"
"31862","369","Lebih Suka Cowo yang..."
"31863","369","RT @AlKohler7: Lagu Mana Yang Paling Kalian Suka"
"31864","369","Lagu Mana Yang Paling Kalian Suka"
"31865","369","RT @luviku: Kamu ganteng nak https://t.co/D0C5hffhSf"
"31866","369","RT @ErmaliaYolanda: @AlKohler7 Mau kamu yg apelin donk @AlKohler7 😍😍"
"31867","369","SELAMAT MALAM MINGGU
SUDAH ADA YANG APEL BELUM
??? https://t.co/5084nDVYqa"
"31868","369","YANG MASIH JOMBLO,,,,BERDOA YA,, SIAPA TAHU MALAM INI ADA YANG TIBA TIBA NYATAKAN CINTA"
"31869","369","Coba Tebak Siapa Foto sebelah ??? https://t.co/lUoNMbrN6X"
"31870","369","CHANNEL RESMI ADP

https://t.co/gfwvNDyJgH"
"31871","369","Kapan lagi bisa milikin jam tangan kesayangan gue?Upload foto""Selfie in the Dark""lo di https://t.co/EmbrYxhPmi seka… https://t.co/kEMH0eJjpo"
