"id_tweet","id_user","tweet"
"32467","376","Nah ini bod0 nya keliatan.. Kalau mau yg ngerti.... Suruh tukang catur bikin podcast... Yakin.. Anda gak ngerti pod… https://t.co/cgkLi8HeFv"
"32468","376","To help ur financial fit.... Check this one out... https://t.co/MIyLNPNrDw"
"32469","376","RT @bankocbcnisp: Wujudkan kebebasan finansial kamu dan mulai sekarang dengan NYALA | OCBC NISP! #FinanciallyFit"
"32470","376","DEWA KIPAS MENGGELEGAR‼️-Deddy Corbuzier Podcast https://t.co/rwHiPPAtTc via @YouTube"
"32471","376","FANS KPOP ANJHENX‼️ - YOUNG LEX - Deddy Corbuzier Podcast https://t.co/u4dZQJocFk via @YouTube"
"32472","376","Tag ini uus dong Tolong!!! https://t.co/Rrj3pejROx"
"32473","376","SERIUS NIH‼️UU ITE FEK LAH⁉️ COKI PARDEDE - Deddy Corbuzier Podcast https://t.co/MD5bX0lHNV via @YouTube"
"32474","376","@hrdbacot gini bro... 
Ini nih problemnya, pengen kaya tapi instan. Cashflow masih seret tapi ngarep return saham a… https://t.co/DemYGBfKHB"
"32475","376","@dimasadrii @hrdbacot Ini nih problemnya, pengen kaya tapi instan. Cashflow masih seret tapi ngarep return saham al… https://t.co/DdM6OqgxZc"
"32476","376","Aldi Taher CHuaaaxz https://t.co/Cro3ahjBgj"
"32477","376","“ Sadarkah bahwa karakter ALPHA anda miliki? 
Tunggu segera di @alpharulesid “ https://t.co/C1R5GBxsDJ"
"32478","376","Cek Gaul anak Twitter... 
LOE kenal ini siapa gak?!

https://t.co/U5UBCO9dbg"
"32479","376","Ada tukang tepuuuuu https://t.co/yqsFdNRqsI"
"32480","376","Dear netizen..
Buat pemula, yang masih bingung dan belum ngerti tentang investasi saham atau crypto..
Menurut gue,… https://t.co/NSOjwaCuyJ"
"32481","376","PENIS.. https://t.co/mtygkcKqws"
"32482","376","ARE U READY @AlphaRulesID https://t.co/fk1dmy1MZc"
"32483","376","DASAR ANJING‼️- HABIB JAFAR - Deddy Corbuzier Podcast https://t.co/pDK6lIeJwl via @YouTube"
"32484","376","FADLAN HOLAO BERTANYA PADA TUHAN. - Deddy Corbuzier Podcast https://t.co/2eUhFKz5bh via @YouTube"
"32485","376","Have u watch this.... Eps. https://t.co/QlDisBzY7d"
"32486","376","AGNEZ MO.. MANTAN KU TER... Deddy Corbuzier Podcast https://t.co/Sr2YZAw1Cz via @YouTube"
"32487","376","BPJS KEMANA SAAT COVID?!- Deddy Corbuzier Podcast https://t.co/Qb4Fodm5Xh via @YouTube"
"32488","376","This is amazing.... https://t.co/8UvMxfKnL5"
"32489","376","BINI UUS KITE UNBOXING🤣 -Deddy Corbuzier Podcast https://t.co/HtpyU97lnZ via @YouTube"
"32490","376","Who is Mister Hu..
Jadi kepo..
Atau mmg produk kita kalah saing? Tambah kepo..
Atau mmg ada hal lain
#SellerAsingBunuhUMKM"
"32491","376","KITA BONGKAR KORUPSI TRILLIUN AN!!  https://t.co/CYUCTmY0PH via @YouTube"
"32492","376","KITA DEBAT ABIS KPI!

https://t.co/396qdVp2sz"
"32493","376","Lupa nama pendakwah yg bangga nabrak anjing kmrn... Ya udah gw Google aja ANJING
nah kan... Die nongol. 🤣"
"32494","376","Kmrn Ada org blg liat anjing di jalan Tabrak aje..
Blom pernah nonton planet of the apes nih org kayanye... 🤗"
"32495","376","$:?(:&amp;?;&amp;$!!!! https://t.co/YxlIYhATfV"
"32496","376","Indonesia yg asik tuh hrsnya adalah Kaum Tengahan... Gak kanan bgt... Ga kiri bgt... Kaum SANTUY.."
"32497","376","Sebelum loe semua main Twitter... Nih RAJA NYA TWITTER!!!
https://t.co/u1O9UFM5Ss"
"32498","376","Nanya KPI.. Hello mas Bro.. Talkshow duduk jauh jauhan suruh pake masker nih!? Sinetron kagak??
🥸"
"32499","376","INI MAH DONGO‼️🤣 -Deddy Corbuzier Podcast https://t.co/WGnyse1I6f via @YouTube"
"32500","376","THE END‼️ - DEDDY CORBUZIER PODCAST https://t.co/ds40rwDyRx via @YouTube"
"32501","376","PAPA IJINKAN MAMA TUK POLIGAMI!???! Sumpah kaga ngerti lagi 😂😂🤣 https://t.co/kbWiziWu3h"
"32502","376","COWO KOK TAS CEWE!? -IVAN GUNAWAN..COME BACK! Ps: gw nunggu SJW kmrn yg ngatain gw anti feminists nyerang lagi...👊-… https://t.co/D7Xl4F1oIX"
"32503","376","PAK MENTERI... ANDA BAKAL KORUPSI JUGA GAK NIH!!!! https://t.co/LJYKwvT4xx via @YouTube"
"32504","376","Renatta Moeloek kita lihat isi HP nya.... https://t.co/stvvvt79Xm"
"32505","376","Abu Janda hanya disini.... https://t.co/L7bfGlPTeU"
"32506","376","Gue lagi bingung sama konten creator baru baru yg pamer cuma kaya doang.. Sedangkan jaman ini lagi banyak org yg bu… https://t.co/NBsg6Q6nhL"
"32507","376","Oh chef Renata. https://t.co/sGcB81WdkL"
"32508","376","Eiger... Butuh klarifikasi!? 🤣🤣🤣"
"32509","376","Kakek koswara dan manusia BIADAB!

https://t.co/sQFlXC91jF"
"32510","376","Ada yg tau cerita kakek koswara? Bisa info? I need this for podcast.. Thank u all..."
"32511","376","VAKSIN BISA GEDEIN PEN1S‼️💪 dr.Tirta - Deddy Corbuzier Podcast https://t.co/XwcUDIuRuG via @YouTube"
"32512","376","MBAK YOU, LOE MAKIN NGACO‼️ - Sakit Jiwa - Deddy Corbuzier Podcast https://t.co/4STgaTIPvg via @YouTube"
"32513","376","PASANGAN LESBIAN  DI INTM❌ -YUMI &amp; CHIKA- Deddy Corbuzier Podcast https://t.co/up5cpsjnDY via @YouTube"
"32514","376","PANDJI CINTA FPI⁉️ GUE YANG PUSING‼️ MARAH BELA NU -Deddy Corbuzier Podcast https://t.co/wCN4STv3iX via @YouTube"
"32515","376","KURUS? NO.. MAMPUS YANG ADA‼️.. - Kita Bongkar Penipuan obat.- Richard L... https://t.co/BCOZjJrM5j via @YouTube"
"32516","376","RAFFI AHMAD, INI BAHAYA‼️- KOMISARIS BEI BUKA SUARA!! - Deddy Corbuzier ... https://t.co/ZreeWHo1dj via @YouTube"
"32517","376","KONSPIRASI SEGITIGA DUNIA DAN ""KOPID"" ATAU CUMA HALU⁉️ - MARDIGU BOSSMAN https://t.co/kbOEks5Utj via @YouTube"
"32518","376","Dear my beloved government.. There are 2 types of influencer.. Those who's base on fame and base on value.. I think… https://t.co/T38teZ54YF"
"32519","376","NADIN AMIZAH, CANTIK NYA KAMU. - Deddy Corbuzier Podcast https://t.co/3UfHM0em2u via @YouTube"
"32520","376","FPI HABIS SUDAH‼️- Bongkar Gerak maut MAHFUD MD -  EXCLUSIVE - Deddy Cor... https://t.co/leIefMo6dK via @YouTube"
"32521","376","JASON RANTI - 0NANI MASAL - Deddy Corbuzier Podcast https://t.co/i3Dvnbkq69 via @YouTube"
"32522","376","FPI BUKAN URUSAN NEGARA LAIN‼️- MENLU Reno Marsudi Bicara! -Deddy Corbuz... https://t.co/YLRfFXKoW1 via @YouTube"
"32523","376","BUKA HIJAB KITA SIKAT‼️- HABIB TERSESAT KE PODCAST -Habib Husein Ja'far-... https://t.co/4gO3YAxWtW via @YouTube"
"32524","376","ADA DUSTA DALAM COVID⁉️- Akhirnya dr.Tompi Bicara!! - Deddy Corbuzier Po... https://t.co/okSDW9ZYTp via @YouTube"
"32525","376","Bersorban di bilang teroris?! https://t.co/PqdonvWmnE via @YouTube"
"32526","376","KAMI BUBARKAN PODCAST 2020 - PODKESMAS - Deddy Corbuzier Podcast https://t.co/3kBLLXBro9 via @YouTube"
"32527","376","BOTAK TIKTOK VS T0KET https://t.co/IYYbCbmRzF via @YouTube"
"32528","376","SUJIWO TEJO, KOK DIA PULANG⁉️ KONSPIRASI❗️- Deddy Corbuzier Podcast https://t.co/TXHBDOIvGe via @YouTube"
"32529","376","1.2 MILLIAR PENONTON di tahun 2020 adalah pencapaian yang tak akan terjadi tanpa kalian... Ur the best!! 
So..
Than… https://t.co/Ovm8SHWKTB"
"32530","376","OPEN BO ON CLOSE THE DOOR - Diana Dee Starlight -Deddy Corbuzier Podcast https://t.co/XVL6xMgYRu via @YouTube"
"32531","376","Selamat Natal buat yang merayakan nya.... Lengkap nya... Di.... #closethedoor https://t.co/tNIR32rnoF"
"32532","376","NATALAN BARENG PENISTA‼️ - COKI PARDEDE - TRETAN MUSLIM  - Deddy Corbuzi... https://t.co/KOkFoOK8dQ via @YouTube"
"32533","376","KENALIN..  CEWE CUTBRAY‼️.. NGERTI DONG.. -Deddy Corbuzier Podcast https://t.co/49cxdUfzut via @YouTube"
"32534","376","SUJIWO TEJO, ADA CEBONG YANG KAMPRET BANGET‼️- Deddy Corbuzier Podcast https://t.co/aGFodKxg7E via @YouTube"
"32535","376","GUE DOYAN DI LIATIN... NIKITA MIRZANI 💪 - Deddy Corbuzier Podcast https://t.co/gWuGVxuAzL via @YouTube"
"32536","376","CHRITINE HAKIM Diantara Ribut Agama, Covid dan Indonesia - Deddy Corbuzi... https://t.co/og9WjELrPw via @YouTube"
"32537","376","KHUSUS 21++ - CEWE JAGOAN KE PODCAST‼️ - Deddy Corbuzier Podcast https://t.co/HOEuoZiVpG via @YouTube"
"32538","376","Tag @ernestprakasa ah.. 🤣 SUNTIK VAKSIN BERANI GA LOE DULUAN‼️ - Dr Tirta - Deddy Corbuzier Podcast https://t.co/ysltjEQbAx via @YouTube"
"32539","376","AGNEZ OH AGNEZ - Deddy Corbuzier Podcast  https://t.co/tF80td4Exy via @YouTube"
"32540","376","Kalau ini panco nya ngeri ngeri sedap... 
But thank u ayah for all the attention.. 
He help me lots in my back inju… https://t.co/u6A4lDQlYT"
"32541","376","KENA AZAB..  PINGSAN DI PODCAST - Deddy Corbuzier Podcast X Pandji Pragiwaksono https://t.co/4c8COL8jnq via @YouTube"
"32542","376","@ernestprakasa @jokowi Hahaha 😂 Sok.. Pak Ernest duluan.. Gue percaya Covid Ada virus nya.. Tapi gue terakhir ga ap… https://t.co/mvv6z2JULi"
"32543","376","@susipudjiastuti Siaaaaaap 🤣💪"
"32544","376","@susipudjiastuti 🤣😅saya nunggu dimasakin Steak. 😀 thank you for the dinner last night!!!! https://t.co/MQflnHNmyy"
"32545","376","HALO FPI‼️ NEKAT STAFSUS PRESIDEN AKHIRNYA BICARA‼️Diaz Hendropriyono / ... https://t.co/CBn8xhZdDk via @YouTube"
"32546","376","BULE CANTIK INI BILANG MUSLIM ITU T3R0RIS⁉️ Trus Mualaf - Deddy Corbuzie... https://t.co/kvCUIO4jcp via @YouTube"
"32547","376","NGUDUT BARENG GOFAR HILMAN 🚬 -Deddy Corbuzier Podcast https://t.co/Mle7JzJIZg via @YouTube"
"32548","376","Dalam keadaan seperti ini Indonesia.. Saatnya kita menahan diri kecuali tuk sebuah kebaikan.. Kalau kita tidak bisa… https://t.co/Y9AZjueBCR"
"32549","376","Kalau gw di kasih sama Darto milih 17M atau Gal Gadot.. Gw langsung Embat Gal Gadot..
... Gw ga Punya Gal Gadot... 
-Deddy Corbuzier 😎🔥😅"
"32550","376","Just done call with @susipudjiastuti thank u much for ur time mam..
And I'm sorry for the inconvenience.. Hope one… https://t.co/Iu1pUpSxNW"
"32551","376","Gue udah ga ngerti lagi.. Saat ngobrol dengan mereka berdua.. Baik sekali.. Skrg... Dicokol KPK.. 
Mungkin gue yg G… https://t.co/6aApgGNwZf"
"32552","376","TERCYDUK‼️ USTAD MAHER, LONTE DAN POLISI‼️ - https://t.co/r8zFFhZBja via @YouTube"
"32553","376","BONGKAR KELUARGA PRABOWO DAN KORUPSI DI DALAMNYA!? https://t.co/pikCgUvyZ1 via @YouTube"
"32554","376","SAYA KENA COVID!! ATAU SAYA DI.. Covid kan?? Bossman Mardigu Sontoloyo - Deddy Corbu... https://t.co/mmmRyHdYH0 via @YouTube"
"32555","376","Menantang ibu susi pudjiastuti ... Exclusive https://t.co/E77GQHWdti"
"32556","376","Banyak hal yang tidak diketahui ttg Korupsi benih lobster... Selasa ini jam 11 pagi.. Kita buka bukaan... #closethedoor"
"32557","376","INDIGO FAKTAP‼️https://t.co/LkIyiKCJkW via @YouTube"
"32558","376","Pemersatu Bangsa..... Doyan lah kalian... https://t.co/rlZtzPemQK via @YouTube"
"32559","376","SEBELUM MABOK DILARANG‼️ UUS - Deddy Corbuzier Podcast https://t.co/KVgetCVRbI via @YouTube"
"32560","376","MASTERCHEF ITU SETTINGAN ‼️ KLARIFIKASI BOBON SANTOSO VS CHEF ARNOLD - D... https://t.co/tjthcMvVhi via @YouTube"
"32561","376","MATI SEKARANG? HAYUK‼️ EXCLUSIVE - Deddy Corbuzier Podcast https://t.co/u8y4QjSPq1 via @YouTube"
"32562","376","SUMPAH SEREM INI MAH. https://t.co/bTlOg3ZMop via @YouTube"
"32563","376","KENAPA MEDIA MENUTUP HAL INI⁉️ KITA BONGKAR - Dr. Tirta Ngamuk!!! - Dedd... https://t.co/sLwQn3MN3Q via @YouTube"
"32564","376","KEADILAN SAK KAREPMU ‼️ https://t.co/zbGAg8VpyH via @YouTube"
"32565","376","NGUDUT BARENG KARNI ILYAS🚬 (Indonesia Kok Gini) - Deddy Corbuzier Podcast https://t.co/dMBmLK9vlj via @YouTube"
"32566","376","Keadilan Sosial ini Milik siapa ya BRO!!!? WISHNUTAMA X Deddy Corbuzier Podcast https://t.co/9sMmiaOlc7 via @YouTube"
