"id_tweet","id_user","tweet"
"21670","264","Saya meminta kepada jajaran BUMN jika ada pihak di bawah jajarannya yg justru membebani perusahaan BUMN agar segera… https://t.co/Y27U6yl43p"
"21671","264","Tidak ada istilah pandang bulu pada kasus korupsi. Melalui kesepakatan kerja sama WBS terintegrasi diharapkan akan… https://t.co/ONWl5hXtvw"
"21672","264","Hari ini, KPK &amp; 27 BUMN menandatangani perjanjian kerja sama terkait pencegahan korupsi. Kerja sama ini mencakup pe… https://t.co/xozeaKL1sV"
"21673","264","Innalillahi wa inna illaihi rojiun, saya turut berduka cita atas berpulangnya Bapak Artidjo Alkostar, seorang peneg… https://t.co/wkPiqJL4TP"
"21674","264","Selamat Tahun Baru Imlek 2572 bagi teman-teman yang merayakan. Semoga kita semua selalu diberikan kesehatan dan kekuatan di tahun ini."
"21675","264","Keputusan ini juga mempertimbangkan tata kelola perusahaan yang baik, terkait keputusan KPK Indonesia serta penyeli… https://t.co/XBnKHPQXD3"
"21676","264","Hari ini, saya bersama Pak Irfan Setiaputra, selaku Dirut Garuda Indonesia mengumumkan langkah tegas pengembalian 1… https://t.co/FYXB7UZMtU"
"21677","264","Saat ini ada 28 BUMN yang sahamnya tercatat di bursa, untuk selanjutnya akan ada 8-12 BUMN lagi yang akan go-public… https://t.co/hT7emV89jF"
"21678","264","Kami akan memastikan dengan adanya Bank Syariah Indonesia semakin kuat keberpihakan dan kesetaraan pasar kepada industri keuangan syariah."
"21679","264","Bank Syariah Indonesia memulai debut di pasar modal ditandai dengan Pembukaan Perdagangan Bursa Efek Indonesia, pag… https://t.co/ezeNOoCbIV"
"21680","264","bahkan mampu menorehkan kinerja yang sangat positif dan membanggakan.

#BankSyariahIndonesia"
"21681","264","Jadilah energi baru bagi ekonomi Indonesia yang senantiasa menerapkan prinsip financial justice dan stability in in… https://t.co/RpHsGuE6aa"
"21682","264","Selamat datang dan selamat bekerja untuk Bank Syariah Indonesia. Pemerintah dan masyarakat Indonesia menitipkan ama… https://t.co/U0wiqv4Is5"
"21683","264","Karena itu, merger tiga bank umum syariah negara dilakukan untuk mewujudkan visi tersebut."
"21684","264","Sebagai negara dengan populasi umat muslim terbesar di dunia, Indonesia sudah sepantasnya memiliki bank syariah bes… https://t.co/mXqQdIehTh"
"21685","264","Alhamdulillah.. Hari ini PT Bank Syariah Indonesia Tbk, diluncurkan secara resmi oleh Presiden @jokowi.

#BankSyariahIndonesia"
"21686","264","Mendapat kepercayaan dan dilantik Presiden @jokowi sebagai anggota Dewan Pengawas (Dewas) Lembaga Pengelola Investa… https://t.co/42GOhDv6gQ"
"21687","264","Bismillahirrahmanirrahim,
ini adalah amanah yang harus saya jaga. Saya merasa terhormat bisa memimpin sebuah organi… https://t.co/qfHNk1hl6i"
"21688","264","RT @medcom_id: Erick: Vaksin Covid-19 Mandiri Bukan Prioritas Pemerintah https://t.co/nznfYFfGpp"
"21689","264","Inisiasi vaksinasi perdana untuk tenaga kesehatan, asisten, dan penunjang tenaga kesehatan di RS BUMN, kemarin. Par… https://t.co/FtKIYgyvD8"
"21690","264","Saya meminta relief ini direstorasi dan mahakarya seni ini dapat dilestarikan.

Kita sama-sama jaga dan rawat seni dan budaya Indonesia."
"21691","264","Sambil mengecek perkembangan restorasi Gedung Sarinah, saya diajak melihat langsung relief warisan Presiden pertama… https://t.co/I3tVZ876Ok"
"21692","264","Saya pribadi sebagai bagian dari umat maupun bangsa Indonesia merasa sangat berduka karena Syekh Ali Jaber adalah p… https://t.co/9oPSseIo5S"
"21693","264","Syekh Ali Jaber merupakan sosok ulama yang tak sekadar memberikan pelajaran dan nasihat, melainkan juga memberi con… https://t.co/rd4ChSk2LN"
"21694","264","Innalilahi wa innailaihi rojiun.

Indonesia kehilangan salah satu ulama besar, guru bagi kita semua. Wafatnya Syekh… https://t.co/slKUDK4IOT"
"21695","264","Disiplin protokol kesehatan dan vaksinasi adalah perjuangan kita bersama untuk mengakhiri pandemi. Insan BUMN SIAP… https://t.co/H2iipeoH0j"
"21696","264","Kini, para tenaga kesehatan, pelayanan publik dan masyarakat bisa divaksinasi tanpa keraguan.

Vaksin Sinovac aman,… https://t.co/2HEMeigHk9"
"21697","264","Alhamdulillah, sudah keluar keputusan fatwa halal dari Komite Fatwa Majelis Ulama Indonesia &amp; juga diberikannya per… https://t.co/jZJkw7MxcN"
"21698","264","Innalillahi wa inna ilaihi roji'un.

Turut berduka cita atas hilangnya pesawat Sriwijaya Air SJ 182. Teriring doa u… https://t.co/oweW0OLdB0"
"21699","264","Ini kerja bersama. Insya Allah, program vaksinasi bisa berjalan dengan baik. https://t.co/l4ZRxErsDs"
"21700","264","Bersama Pak Menkes, Budi Sadikin, hari ini saya melakukan audiensi dengan KPK terkait pengadaan vaksin dan program… https://t.co/zvEmuX1Qp8"
"21701","264","Kesiapan ini masih perlu ditingkatkan lagi, dan perlu dukungan semua pihak, baik di pusat maupun di daerah, karena… https://t.co/of0ya49dUo"
"21702","264","saya melihat kesiapan Bio Farma untuk menjalankan penugasan penyediaan, produksi dan distribusi vaksin COVID-19 ke seluruh provinsi."
"21703","264","Alhamdulillah, dengan memiliki kapasitas produksi untuk 250 juta dosis per tahun, fasilitas penyimpanan yang memada… https://t.co/F8XfcImk3w"
"21704","264","Hari ini, saya mengunjungi Bio Farma untuk memastikan kesiapan kapasitas produksi, penyimpanan, dan distribusi untu… https://t.co/Yy1LgH3qdp"
"21705","264","Hal ini sesuai dengan instruksi dari Presiden Jokowi untuk tetap memastikan rakyat yang ekonominya terdampak pandem… https://t.co/e7a9KLHQXw"
"21706","264","Pemerintah juga akan melanjutkan program stimulus pada tahun 2021 untuk pemulihan ekonomi dan penanganan Covid-19 t… https://t.co/XobPf8PNWa"
"21707","264","Pemerintah memperpanjang waktu pemberian bantuan keringanan biaya listrik PLN berupa diskon 100 persen atau gratis… https://t.co/VeoTDVdIrY"
"21708","264","Mobil listrik memiliki banyak manfaat selain manfaat ekonomi, karena lebih murah. Dari Jakarta ke Bali, kalau biaya… https://t.co/bpJSk3qHtc"
"21709","264","Hari ini saya mencoba mengendarai mobil listrik dan mengecek kesiapan stasiun pengisian kendaraan listrik (charging… https://t.co/xbm2tvp90L"
"21710","264","Semoga Allah SWT menerima puasa dan semua Ibadah kita di bulan Ramadan, serta kita semua selalu dalam keberkahan. S… https://t.co/1u4DDfHujK"
"21711","264","Semoga penghargaan apapun tidak membuat kami terlena, tetapi terus semakin solid bekerja, menjalankan program kerja Presiden."
"21712","264","Tapi yang pasti, setiap prestasi, apapun, adalah bagaimana kita bisa menerima saran, terbuka terhadap kritik. Dan s… https://t.co/1w0D6CWUDv"
"21713","264","Ada beberapa survey yang menyebutkan Kementerian BUMN menjadi salah satu yang terbaik atau terpopuler. Kami akan  j… https://t.co/9DJ9t0qbSU"
"21714","264","Rest in peace, Kobe Bryant. You will always be remembered and will continue to live on in all of our memories. My h… https://t.co/mnzMtRdQWf"
"21715","264","Kobe Bryant, Thank you for every contribution to the basketball community. Thank you for being a great person.

#RIPKobeBryant"
"21716","264","Beliau figur yang menyenangkan dan begitu ramah. Saat berbincang dengannya begitu akrab. Sebagai ambassador FIBA Du… https://t.co/qoVQuRvBxP"
"21717","264","Saya terkejut sekali dan sangat berduka. Pertemuan terakhir saya dengan Kobe adalah pada saat final Piala Dunia Bas… https://t.co/XyoO9J6QI7"
"21718","264","Dirgahayu Tentara Nasional Indonesia ke 74. 
TNI profesional adalah kebanggaan rakyat."
"21719","264","Saya doakan yang terbaik untuk kesuksesan Vamiga. @SMPertamina @vamigamichel

Once a Blue, always a Blue.… https://t.co/CLFa58kD6C"
"21720","264","Terima kasih Vamiga Michel untuk 9 musim &amp; 213 pertandingan bersama Satria Muda Pertamina. Terima kasih untuk dedik… https://t.co/ims5MldyLm"
"21721","264","Semoga kita semua bisa meneladani ketekunan dan kerja keras beliau. Sosok almarhum Bapak Habibie menunjukkan serta… https://t.co/u8i2NDGP7q"
"21722","264","Inna lillahi wa inna ilaihi roji'un. 

Turut berduka cita atas wafatnya Bapak BJ Habibie tadi sore pukul 18.05. Sem… https://t.co/iseVwUx9bV"
"21723","264","Ayo terus bersatu agar kita menjadi nomor SATU! Indonesia."
"21724","264","Tantangan global tidak bisa dihadapi oleh segelintir orang saja. Salah satu aset Indonesia yang terbaik adalah manu… https://t.co/6sCtadZmS1"
"21725","264","Saya percaya bahwa Persatuan adalah denyut nadi bangsa Indonesia yang akan terus ada di setiap langkahnya. Harapan… https://t.co/QlWOmMIe7J"
"21726","264","Permasalahan toleransi terhadap keberagaman harus menjadi salah satu fokus kita bersama, dan semangat Bhinneka Tung… https://t.co/k2oLg0RkYl"
"21727","264","Bagaimanapun, bukanlah hal yang mudah, dari awal berdiri, hingga kini hampir tujuh puluh lima tahun bangsa ini merd… https://t.co/l4qlLYFfO0"
"21728","264","Indonesia ada karena keberagaman. Pancasila adalah perekat yang dibentuk oleh para founding fathers kita untuk menguatkan kebersamaan kita."
"21729","264","Tatjana Saphira - Mustika https://t.co/aVXoZVuNHv"
"21730","264","Zara JKT48 - Virgo https://t.co/1eEqjY49G8"
"21731","264","Dian Sastrowardoyo - Dewi Api https://t.co/fFd4G2iNcI"
"21732","264","Bront Palarae - Pengkor https://t.co/54H28I0zQF"
"21733","264","Lukman Sardi - Ridwan Bahri https://t.co/LcQ42pD7pJ"
"21734","264","Ario Bayu - Ghani Zulham https://t.co/kQWDQDp3qJ"
"21735","264","Della Dartyan - Nila Umaya https://t.co/mkE4evVAAw"
"21736","264","Vanesha Prescilla - Cempaka https://t.co/uxpFLT9XQw"
"21737","264","Nicholas Saputra - Aquanus https://t.co/MNv4TeInR1"
"21738","264","Joe Taslim - Mandala https://t.co/YZBDnPmdnU"
"21739","264","Kelly Tandiono - Bidadari Mata Elang https://t.co/8oajFsQc4K"
"21740","264","Daniel Adnan - Tanto Ginanjar https://t.co/1rFB0xYzdv"
"21741","264","Hannah Al Rashid - Camar https://t.co/6TZCg4LcoU"
"21742","264","Asmara Abigail - Desti Nikita https://t.co/mKeo7vS1qz"
"21743","264","Tara Basro - Merpati https://t.co/7LoPCpgsmM"
"21744","264","Chelsea Islan - Tira https://t.co/8p7wFhNVPQ"
"21745","264","Pevita Pearce - Sri Asih https://t.co/SIxQxG0lX8"
"21746","264","Chicco Jerikho - Godam https://t.co/GwB8Jr5nZT"
"21747","264","Para bintang yang akan bermain dalam film-film Jagat Sinema Bumilangit adalah :
Abimana Aryasatya - Gundala https://t.co/LHegKH9pHS"
"21748","264","Semoga setelah ini, para pelaku industri kreatif akan semakin bergairah dan semangat untuk mengembangkan karya-kary… https://t.co/JgNAB18I6u"
"21749","264","Saya juga berharap adanya Jagat Sinema Bumilangit dapat mengangkat nilai-nilai ke-Indonesiaan kita agar dapat lebih… https://t.co/F7GJHnNEn9"
"21750","264","Dengan adanya karya kreatif ini saya optimis bahwa negara kita mampu untuk menjadi negara pop-culture dengan nilai-… https://t.co/F5nQ1oJjXd"
"21751","264","Hari ini para pemain untuk Jagat Sinema Bumilangit resmi diperkenalkan. Jagat Sinema Bumilangit dapat menjadi langk… https://t.co/0pwQWkXRUA"
"21752","264","Semoga Hari Raya Idul Adha ini semakin mendekatkan kita kepada Allah SWT, memperkuat Iman &amp; Taqwa, serta semoga mak… https://t.co/QTYfFNFMwb"
"21753","264","Senang sekali bertukar pikiran dan pengalaman bersama Gubernur Jawa Timur Ibu @KhofifahIP dan Wakil Gubernur Jawa T… https://t.co/ru1w2Mw7t6"
"21754","264","Insyaallah lima tahun lagi semuanya lebih baik dari hari ini dan Indonesia menjadi negara yang maju, adil dan makmu… https://t.co/LvGwAdhtmo"
"21755","264","Dalam 5 tahun kedepan ada 5 prioritas utama kita: melanjutkan pembangunan infrastruktur, pembangunan sumber daya ma… https://t.co/lVSjjix8ep"
"21756","264","Visi Indonesia telah disampaikan oleh Pak @jokowi dan Abah @Kiyai_MarufAmin kemarin. https://t.co/bdUcnf74bk"
"21757","264","Sepanggung lagi dengan sahabat. Buat kami, berbeda sementara, sahabat selamanya. Young Penting Indonesia. @sandiuno https://t.co/c8ggsvnGQF"
"21758","264","Semoga pertemuan hari ini menjadi awal yang baik untuk kita semua. https://t.co/R17WvhSxfl"
"21759","264","Selamat pagi dari MRT Jakarta. https://t.co/Jmw4fwSG1u"
"21760","264","Dan juga apresiasi kepada KPU, Bawaslu, Polri dan TNI yang telah menjalankan proses pemilu secara jujur dan transpa… https://t.co/sqXSvpsxIZ"
"21761","264","Sekali lagi, saya ucapkan terima kasih dan penghargaan kepada para relawan, simpatisan, dan pendukung pasangan Joko… https://t.co/aWZxnDD3uE"
"21762","264","Indonesia adalah Bangsa yang Besar dan Kuat dari dan karena perbedaan. Kita harus bersatu dan dan bekerja keras ber… https://t.co/9uwbkDRqXq"
"21763","264","Alhamdulillah.
Selamat untuk Indonesia.

Keputusan MK merupakan hasil final yang telah melalui rangkaian proses huk… https://t.co/qu1YupSXfb"
"21764","264","Meningkatkan kualitas olahraga Indonesia agar bisa bersaing di level dunia merupakan tanggung jawab besar kita semua."
"21765","264","Keterwakilan ini juga berarti Indonesia akan turut aktif dalam menyebarkan semangat olimpiade yang membawa nilai-ni… https://t.co/jbeG7ITHED"
"21766","264","Adanya perwakilan di IOC merupakan hal yang positif untuk Indonesia karena dengan ini kita bisa terus meningkatkan… https://t.co/NXfNo2TAp3"
"21767","264","Sebuah kehormatan bagi saya dan untuk kita semua, bangsa Indonesia, bisa kembali memiliki perwakilan di Internation… https://t.co/RK3apinlOI"
"21768","264","Saya yakin Indonesia siap menjadi tuan rumah Olimpiade 2032, kamu?"
"21769","264","Harapan saya selanjutnya, semoga kita diberikan kesempatan untuk menjadi tuan rumah  event-event olahraga dunia lai… https://t.co/nJdI3sAiDV"
