"id_tweet","id_user","tweet"
"30148","352","3. Maka Islam memperkaya khazanah kebaikan yang sudah ada sekaligus membangun tradisi-tradisi baru yang lebih baik.… https://t.co/2zIddOh593"
"30149","352","2. Bakda Maghrib kemarin, saya berkesempatan menyapa jamaah yang hadir. Saya sampaikan bahwa Islam tidak datang di… https://t.co/8h1HxV8wbw"
"30150","352","1. Dulu lokasi ini tempat prostitusi. Kang Dedi Mulyadi mengubahnya menjadi masjid megah. Masjid Tajug Gede namanya… https://t.co/Mxtgt1ZjCB"
"30151","352","Sore ini di perpustakaan rumah, saya membaca bunga rampai tulisan Almarhum M. Natsir, pahlawan nasional, founding f… https://t.co/FePGrtt8CX"
"30152","352","Gowes lagi... . .

Dua nikmat yang sering 
terperdaya padanya manusia : kesehatan dan kesempatan"", demikian Rasul y… https://t.co/2fHyyeZULc"
"30153","352","Semalam, bakda maghrib, silaturahim spontan di Masjid Jam'iyatul Qudsiyyah Desa Pringgasela. . .

Saya sampaikan ti… https://t.co/fV01i9S2Wb"
"30154","352","Siang ini hadir di Konferensi anak muda Indonesia di Kupang NTT, topiknya tentang hoaks dan cara menyikapinya. . .… https://t.co/92lvjUOrUX"
"30155","352","Semalam di Citra Indah City bersama Sayyid Seif Alwy ahbaburrosul_indonesia. . .

Dalam sebuah hadisnya, Rasul yang… https://t.co/kcPSch6YzL"
"30156","352","Dalam kajian tafsir di Masjid Hubbul Wathan IC Mataram, saya berbagi dengan para jamaah tentang kisah perpindahan k… https://t.co/BUhKDuJGrd"
"30157","352","Jumpa di bandara dengan sahabat lama Sandiaga Uno sandiuno. . .

Kami berkawan lama, beberapa kali Beliau ke Lombok… https://t.co/z2oDS9Wngi"
"30158","352","Hari kedua di Tanah Banjar, bersama H. Mardani Maming mardani_maming melanjutkan ziarah ke para guru. . .

Guru Dan… https://t.co/Ou3WVkGzu8"
"30159","352","Kemarin ziarah ke makam Guru Sekumpul. Salah satu jangkar Ahlussunnah Waljamaah, poros keberkahan tanah Banjar dan… https://t.co/MDx6xObXjy"
"30160","352","Siang tadi, setiba dari Bali, bersama H. Mardani H. Maming mardani_maming dan beberapa sahabat bersilaturahim kepad… https://t.co/3tVnx9T5tC"
"30161","352","Pagi tadi mengisi di Evaluasi Tahunan Nasional BPOM ( Badan Pengawasan Obat dan Makanan) yang dilaksanakan di Bali.… https://t.co/0SAwgZkcM9"
"30162","352","Bagi saya, semua guru saya adalah orang hebat.

Ada Ustadz Sahar yang mengajar matematika dengan ilustrasi ilmu war… https://t.co/nKPESuMfJR"
"30163","352","Isu Palestina bukan sembarang isu. . .

Bagi kita, Penjajahan Israel terhadap Palestina adalah wajah buruk kolonial… https://t.co/9rrIKeYgHH"
"30164","352","Imam Bushiri merangkai 160 bait qasidah berisi pujian, perjalanan dan tawassul kepada Nabi SAW. Qasidah itu dikenal… https://t.co/CwmL2YCayf"
"30165","352","Dari Kendari-Konawe, di bawah helikopter terhampar hutan lebat sampai sesaat sebelum mendarat. Rumah-rumah hampir t… https://t.co/IGRDNe85U3"
"30166","352","Tidak ada yang perlu dikhawatirkan dari peraturan yang terinspirasi dari ajaran agama, selama telah dibahas dan dis… https://t.co/F3n0XcKg9U"
"30167","352","Rapeners Pakpahan namanya. Anak muda asal Medan yang tinggal di Jogja dan berwirausaha. . .

Sejak tiga tahun lalu… https://t.co/ZMmBUP0KMi"
"30168","352","Semalam shalawatan bersama Habib Syech Abdul Qodir Assegaf @syaikhassegaf dan mardani_maming di Lombok Utara. . .… https://t.co/pphi5FkgAh"
"30169","352","Bersyukur dapat melanjutkan kajian tafsir bakda Jumat di Masjid Hubbul Wathan Islamic Centre Mataram. Kemarin menga… https://t.co/VsEpksMQZg"
"30170","352","Bersyukur dapat melanjutkan kajian tafsir bakda Jumat di Masjid Hubbul Wathan Islamic Centre Mataram. Kemarin menga… https://t.co/njtjvbT6mz"
"30171","352","Aamiin yaa Rabb.. #Repost ericamajdi
・・・
ALLOH, forgive my sins and the sins of my father &amp; mother, have mercy on t… https://t.co/fstZmphKgp"
"30172","352","Saling belajar dengan para alumni Al-Azhar (Al-Ahram), kyai muda serta para penggiat jaringan Gus Dur di Sumenep Ma… https://t.co/H5l0ojKm8I"
"30173","352","Di pesisir Madura tepatnya Kedungdung Bangkalan, Pesantren Miftahul Ulum dibawah asuhan KH. Ayyub Mustofa ikut memb… https://t.co/xJmL6Vo3kw"
"30174","352","Bicara wisata halal, jangan terpikir bahwa ini membatasi. Wisata halal justru adalah kreasi dan segmen baru. Mengha… https://t.co/Z8wwFu6Wyb"
"30175","352","Berjumpa dan berdiskusi sejenak dengan Rektor Universitas Trunojoyo Madura (UTM) Dr. M. Syarif pagi ini, sebelum me… https://t.co/p47W1BRtwN"
"30176","352","Beliau mengenalkan diri sebagai Hendri Pedagang Martabak dari Pekanbaru. Dua hari lalu jumpa usai tawaf sunah di pe… https://t.co/jWiAKFDIxO"
"30177","352","Kalimat tauhid adalah persaksian kita di dunia dan akhirat. Padanya ada dua asma termulia. Asma ALLOH yang kepadaNy… https://t.co/CKZYr2oF4b"
"30178","352","Perilaku tercela menggunakan kalimat tauhid untuk tujuan kekuasaan tidak boleh menyebabkan kita ikut melakukan perb… https://t.co/KDHGcSotLY"
"30179","352","Namun cinta NKRI adalah satu hal, sedangkan membakar bendera yang bertuliskan kalimat tauhid adalah hal lain. Bagi… https://t.co/5rIL6It67n"
"30180","352","Bagi saya, NKRI adlh maslahat nyata, sdgkan khilafah adlh maslahat prediktif. Scr kaidah, al-maslahah al-mutahaqqiq… https://t.co/2PlBwX2WXA"
"30181","352","Karena nilai-nilai dasar yang diperjuangkan Islam telah ada, utamanya nilai-nilai ketuhanan, kemanusiaan, persatuan… https://t.co/z9LyD73XVD"
"30182","352","Saya meyakini, Islam tidak memerintahkan satu sistem pemerintahan tertentu, namun memberi panduan nilai-nilai mulia… https://t.co/ETI59fM3XC"
"30183","352","Saya muslim yang cinta NKRI. Negara bangsa ini bagi saya adalah amanah dari ALLOH yang wajib dijaga dan dikokohkan.… https://t.co/M9oNiSfbUf"
"30184","352","Hoaks dan fitnah. . .

Dua ayat dalam Alquran tentang pentingnya tabayyun ; hati-hati dan klarifikasi . Cek dan kro… https://t.co/RpS0z4mrke"
"30185","352","Usai Apel Hari Santri hari Sabtu kemarin di Bontang bersama Ibu Walikota, Wakil Walikota dan Pimpinan DPRD serta pa… https://t.co/36FUsciaN7"
"30186","352","Bersama Takmir Masjid Al-Kautsar Bontang, bakda taklim subuh hari ini. . .

Di taklim saya sampaikan kisah dari Ras… https://t.co/S3gaRJFohh"
"30187","352","Semalam di kilometer 81 Karetan jalur Samarinda-Bontang. . .

Semangkuk Soto Bandung. 
Segelas Bandrek. 
Sepiring T… https://t.co/C8HKCeQymc"
"30188","352","Menjelang subuh hari Rabu lalu di Masjid Sayyidina Husein di Kairo. . .

Dinamakan demikian karena di sini makam be… https://t.co/o0o0BoaS08"
"30189","352","Bersama ananda Muhammad Rifki Farabi di depan Pusat Pemantauan dan Fatwa Elektronik Al-Azhar di Kairo. . .

Pusat P… https://t.co/olG33WVLgw"
"30190","352","Bersama Guru saya Prof. Dr. Abdul Fadhil Al-Qushy, Guru besar di Al-Azhar dan salah seorang tokoh utama Asy'ariyyah… https://t.co/fbJWwYs4c8"
"30191","352","#Repost @tgbID with get_repost
・・・
Selamat buat santriwati Pondok Pesantren Nurul Haramain Nahdlatul Wathan (NW) Bo… https://t.co/2gCP0BpBZV"
"30192","352","Ditemani ananda Azzadiina Johara, semalam, saya menghadiri undangan pertemuan terbatas bersama Habib Umar bin Hafid… https://t.co/jYsgY6A3ta"
"30193","352","Ability. Itu yang tertulis diatas plat keemasan, dalam kotak yang dibuka Presiden Jokowi @jokowi . Buang pikiran ba… https://t.co/cy7RJhZ531"
"30194","352","Anak-anak korban gempa Di Lombok Utara mengirim pesan dahsyat untuk kita semua. Semangat persaudaraan tak boleh pad… https://t.co/K0mjhEHVjB"
"30195","352","Kemarin, gempa besar diikuti tsunami melanda Palu, Donggala dan sekitarnya. Mari panjatkan doa terbaik kita, semoga… https://t.co/25l3ICijPP"
"30196","352","Guruku yang mulia Al-Habib Umar bin Muhammad bin Salim bin Hafidz habib_umar ,ulama panutan dengan ilmu, adab dan k… https://t.co/b0cz2mCPB6"
"30197","352","""Barangsiapa ingin dilapangkan rezekinya dan dipanjangkan umurnya maka hendaklah bersilaturahim"", demikian hadis sh… https://t.co/6QjiPe6Pqe"
"30198","352","Azhary Travels Partner ( ATP ), wadah para sahabat alumni pemilik travel. Seratus lebih anggotanya. Motto mereka :… https://t.co/fWqsKV0qG4"
"30199","352","Memenuhi undangan silaturahim Dubes Mesir untuk RI, Bapak Amr Moawwad. Di dinding penghubung tangga ini, terpampang… https://t.co/UHSkOX7ZKc"
"30200","352","Berbagi kebaikan di Musyawarah Ulama Alquran malam ini di Bogor. Berada ditengah para sahabat, pencinta Alquran, ba… https://t.co/kIeSeK2SDR"
"30201","352","Tentang TGBNomics oleh seorang sahabat, Bapak Ikhwanul Kiram, wartawan senior Republika. Alhamdulillah. Untuk lengk… https://t.co/fa3PYWXsu1"
"30202","352","Di rumah Bapak Dahlan Iskan #Dahlaniskan, bersama Gubernur Kaltara Bapak @irianto_lambrie, kami diskusi beragam hal… https://t.co/vbjCgFV2IH"
"30203","352","Selama 10 tahun tentu banyak sekali cobaan dan tantangan yang kita hadapi. Tetapi Alhamdulillah, semuanya bisa kita… https://t.co/N2WoyUJfSb"
"30204","352","Alhamdulillah. Hari ini sepuluh tahun perkhidmatan telah tuntas. Dengan karunia ALLOH, yang terbaik telah diikhtiar… https://t.co/dpwemEMoWf"
"30205","352","Alhamdulillah wasy-syukrulillah. Malam penggalangan dana sekaligus peluncuran buku TGBNomics, berhasil mengumpulkan… https://t.co/Gs7kHVxbVT"
"30206","352","#tuangurubajangofficial #ntbbangunkembali #lombokbangunkembali #sumbawabangunkembali #launching #peluncuranbuku… https://t.co/FoFFkZRlsx"
"30207","352","Alhamdulillah. Hari ini Bank NTB resmi menjadi Bank NTB Syariah. Perjalanan konversi hampir dua tahun telah tuntas.… https://t.co/Y4Ec5kF8Xf"
"30208","352","Menyempatkan berkunjung ke SMP Negeri 6 Mataram, sebelum bertolak ke Sumbawa. Senang bertemu dan melihat keceriaan… https://t.co/grip4SWTbN"
"30209","352","Mengawali agenda kegiatan hari ini dengan Apel Siaga NTB Bangun Kembali di Lapangan Gunung Sari Kab. Lombok Barat.… https://t.co/WoPEIbO76k"
"30210","352","Mendampingi Presiden RI @jokowi dalam prosesi penyerahan secara simbolis buku tabungan dana bantuan rekonstruksi ru… https://t.co/2Rhvsafe7O"
"30211","352","Menyambut kedatangan Presiden RI @jokowi yang kembali berkunjung dan menemui para korban gempa di NTB pada akhir pe… https://t.co/Jjt9kN2nae"
"30212","352","Regrann from @humasntb

Terima kasih atas kerja keras perjuangan dan pencapaian prestasi para atlet NTB di Asian Ga… https://t.co/w5JDDbczM8"
"30213","352","Srikandi ring tinju dari Kabupaten Sumbawa Barat NTB, Huswatun Hasanah berhasil menyumbangkan medali perunggu dari… https://t.co/3TziEhR51M"
"30214","352","Dalam perjalanan menuju lokasi shalat Jumat, di Desa Pemenang sempat menengok proses pembangunan prototype RISHA (r… https://t.co/xxw8sxl73A"
"30215","352","Selamat kepada dua atlet  NTB Fadlin dan Lalu Muhammad Zohri yang tergabung dalam tim lari estafet 4x100 m putra In… https://t.co/1fXLO6saDz"
"30216","352","Ketika musibah itu datang, kita jangan berat mengulurkan tangan untuk saling membantu. Apalagi bagi institusi yang… https://t.co/Hb6fetR4pE"
"30217","352","Bersama para sahabat Fatih Seferagic @FatihSeferagic , Dian Pelangi @dianpelangi , dan rekan dari ACT… https://t.co/l0le8T4Pah"
"30218","352","Pascamusibah gempa bumi di Lombok dan Sumbawa, banyak akun media sosial yang begitu masif menyebar berita bohong al… https://t.co/6qw9EWGjfN"
"30219","352","Menerima langsung sumbangan dana gotong royong dari seluruh staf Kementerian Dalam Negeri RI senilai 700 juta rupia… https://t.co/LI7EbqOYRi"
"30220","352","Duet Dhita Juliana dan Putu Dini Jasita Utami dari NTB berhasil menyumbangkan medali perunggu untuk Indonesia di ca… https://t.co/DTxyyVPvVe"
"30221","352","Mendampingi Ketua MPR RI Bapak Zulkifli Hasan @ZUL_Hasan meninjau kawasan terdampak bencana gempa bumi di Desa Keru… https://t.co/YqZWoSwLcU"
"30222","352","Deklarasi “NTB Bangun Kembali” di Kecamatan Pemenang, Kabupaten Lombok Utara di awal pekan ini, melalui apel yang d… https://t.co/VejjONtUSA"
"30223","352","Melihat langsung aktivitas masyarakat di pasar tradisional Pemenang di Kecamatan pemenang, Kabupaten Lombok Utara,… https://t.co/Tz6gcI5810"
"30224","352","Saat mendampingi Menteri Perhubungan RI Bapak Budi Karya Sumadi budikaryas dalam kunjungan kerja ke NTB Ahad 26 Agu… https://t.co/1NLnqVFV4m"
"30225","352","Karateka andalan NTB, Zigi Daresta meraih perunggu untuk Indonesia. Alhamdulillah. Anak muda yang hebat, dengan mas… https://t.co/vBCRg0sJkf"
"30226","352","I Gusti Bhagus Saputra, putra NTB, meraih perak di cabang BMX Asian Games. Hanya terpaut 0,64 detik dari peraih ema… https://t.co/Mnx7Bi4lEf"
"30227","352","Regrann from @humasntb

Menyapa dan bernyanyi dengan warga terdampak gempa bumi yang mengungsi di Halaman Kantor Gu… https://t.co/l3J8v7xJ61"
"30228","352","Regrann from @humasntb  -  Presiden RI Bapak @jokowi telah menandatangani Instruksi Presiden (Inpres) tentang Penan… https://t.co/MKB8pWFS0s"
"30229","352","Jelang Sholat Taubah, Doa dan Dzikir bersama di Lapangan Gunung Sari Lombok Barat.

#tuangurubajangofficial… https://t.co/J41d7gocKr"
"30230","352","Di Kayangan, tempat pengungsian bakda shalat Ied. Sang Nenek mengusap bibir cucunya tercinta. Dengan lembut penuh k… https://t.co/SSE2xK86cf"
"30231","352","Selalu ada orang2 yang senantiasa memuji asma ALLOH di dalam setiap  keadaan, baik atau buruk. Dalam konteks kita b… https://t.co/oSfcUBDmfJ"
"30232","352","Menyambut dan mendampingi Wakil Presiden RI Bapak H.M. Jusuf Kalla dalam kunjungan kerja ke NTB. Selain mengunjungi… https://t.co/VRxLhfFjZF"
"30233","352","Mengunjungi para korban terdampak gempa di posko-posko pengungsian  di kawasan Sambelia, Kabupaten Lombok Timur. Me… https://t.co/68I8neSjp8"
"30234","352","Mengecek Pelabuhan Kayangan, pelabuhan utama penghubung Lombok-Sumbawa. Gempa semalam menyisakan jejak kerusakan. S… https://t.co/EWg0TvKSwZ"
"30235","352","Menjenguk sekaligus menyemangati para pasien di Puskesmas Aikmel Kab. Lombok Timur yang dievakuasi ke tenda darurat… https://t.co/fH0M5kLUOv"
"30236","352","Pagi ini, pasar tumpah Paokmotong Lombok Timur. Ramai, berkah. Lombok insya Allah telah pulih.… https://t.co/goHUOh4eNg"
"30237","352","Regrann from @humasntb  -  Beberapa hari lalu, sempat beredar video beberapa warga Dusun Lendang Batu, Desa Kayanga… https://t.co/Id0tLrl0FL"
"30238","352","Regrann from @humasntb 
Sehubungan dengan beredarnya informasi di media sosial terkait keterlambatan penyaluran ban… https://t.co/4YYFIY9inq"
"30239","352","Kami semua di Nusa Tenggara Barat, khususnya di Lombok, Insya ALLOH, hati dan jiwa kami penuh dengan optimisme bahw… https://t.co/CZwTtV7gSw"
"30240","352","Regrann from @humasntb 

Terus berjuang, kuatkan motivasi diri untuk selalu berkontribusi meneruskan cita-cita muli… https://t.co/QfpwVgR3EL"
"30241","352","https://t.co/ODR0ysDN6d"
"30242","352","Mengukuhkan 28 siswa-siswi dari Kabupaten/Kota se-Nusa Tenggara Barat sebagai Pasukan Pengibar Bendera Pusaka (Pask… https://t.co/AQrZMSlELa"
"30243","352","Menerima kunjungan Walikota Bandung sekaligus Gubernur Jawa Barat Terpilih Bapak @ridwankamil dan juga Pemimpin Red… https://t.co/nrhu6wYChu"
"30244","352","Menggelar rapat terbatas dengan sejumlah kepala OPD Lingkup Pemprov NTB, untuk membahas sejumlah langkah pedoman pe… https://t.co/T9z2SRHQ7m"
"30245","352","Regrann from @humasntb 

Pernyataan resmi mewakili Pemerintah Provinsi Nusa Tenggara Barat. 

Setelah dilakukan pro… https://t.co/Yn9FTFGs04"
"30246","352","Shalat maghrib di mushola darurat ini tidak direncanakan. Mulanya, di jadwal Beliau (Presiden @jokowi) mendengar pa… https://t.co/263GmHLCLp"
"30247","352","Meninjau para pengungsi di Dusun Terengan, Desa Pemenang Timur, Kec. Pemenang, Kab. Lombok Utara, dengan membonceng… https://t.co/IRwVehAsO2"
