"id_tweet","id_user","tweet"
"19630","238","tindak lanjut tiang pln hampir jebol , sdh beres semoga aman smuaaa aminnn https://t.co/1UgW0IwOLX"
"19631","238","tindak lanjut tanggul jebol hampir banjir 19/2 , dibikin tanggul sementara , tp smoga kedepan semua bisa diperbaiki… https://t.co/AsJHgDN6pA"
"19632","238","Tindaklanjut jalanan di klp gdg timur https://t.co/3rYVn15VQJ"
"19633","238","Gaskeunnn @fpdip_jakarta yuhuuu https://t.co/dSi1U9mlw0"
"19634","238","RT @fpdip_jakarta: Fraksi PDI Perjuangan melalui Ketua komisi D memanggil Pemprov DKI - @DinasSDAJakarta untuk mempertanggungjawabkan banji…"
"19635","238","Part 3  harusnya kuota petugas2 lapangan ditambah karena selain mengurangi pengangguran , faktanya di lapangan cont… https://t.co/fnsV6sxoP4"
"19636","238","Part 2 banyak sekali yg ingin melamar posisi ini setiap tahunnya , dan ternyata karena kontraknya adalah per tahun… https://t.co/uUNbjxNsfk"
"19637","238","Part 1 setelah sy cek ke biro perekrutan PJLP Penyedia Jasa Lainnya Perorangan untuk petugas biru ada di Sudin SDA… https://t.co/QT6Ry25qW0"
"19638","238","https://t.co/TQ7E2QQ38F"
"19639","238","https://t.co/SVTGGn7X30"
"19640","238","listrik nyala langsung geber pompa BGR semoga kelapa gading cilincing koja aman dan seluruh jakarta jg tdk banjir l… https://t.co/lHBieCqExh"
"19641","238","kordinasi dan monitor pompa 🙏🏻 https://t.co/U85vEfpTMM"
"19642","238","hujan gledek petir yaampun stay safe smua kordinasi dan monitor pompa , yg listrik mati pake jenset semoga aman https://t.co/niJXr7dJLK"
"19643","238","antisipasi banjir pomPaa ; kordinasi monitor siaga🙏🏻 #cikoding #KELAPAGADING #cilincing #koja https://t.co/LS7nWbsDAO"
"19644","238","antisipasi banjir kerukan kali , kordinasi monitor siaga🙏🏻 #cikoding #KELAPAGADING #cilincing #koja https://t.co/mXOMiQmlAV"
"19645","238","Musyawarah Rencana Pembangunan Musrenbang Tingkat Kecamatan Koja https://t.co/ZDf0Kc9H0H"
"19646","238","Musrenbang musyawarah rencana pembangunan tingkat kecamatan kelapa gading https://t.co/Mps8Xhm2rb"
"19647","238","kordinasi dan monitor pompa persiapan hujan prediksi bmkg di cikoding https://t.co/ASAn9VnBy8"
"19648","238","https://t.co/zZjro6WKAR"
"19649","238","https://t.co/scWrVB7g7Q"
"19650","238","RT @PDI_Perjuangan: Aksi konkret PDI Perjuangan membantu korban banjir dan bencana alam. Baguna semakin solid bergerak dalam mengatasi masa…"
"19651","238","Normalisasi wajib dilakukan segera  pemprov dki jakarta 🙏🏻 dan infrastruktur penanggulangan banjir jg diadakan sege… https://t.co/UZCHmyCI3l"
"19652","238","RT @fpdip_jakarta: Program naturalisasi yang digaungkan Gubernur DKI Jakarta Anies Baswedan semasa memimpin Jakarta 2017 lalu hingga saat i…"
"19653","238","https://t.co/eJTpQPQrIE trims atas kerja keras petugas biru dan sda jakut 🙏🏻 https://t.co/kVbBeYufzW"
"19654","238","https://t.co/RFQy8n9h2i https://t.co/G2oGFnKeNL"
"19655","238","https://t.co/dwxtoTkoE7 https://t.co/icG0Ptg48i"
"19656","238","monitor dan siaga untuk pompa , saluran , penampungan dan sampah2 yg menghambat aliran air https://t.co/0gndFgDcMu"
"19657","238","#PolitikHijau @PDI_Perjuangan https://t.co/2D3nX1hrqO"
"19658","238","pompa mobile on monitor dan kordinasi dgn sda berjalan trus semangat https://t.co/85cBrG3Oyh"
"19659","238","pantauan pompa , pembersihan sampah dan penampungan monitor dan siaga selalu utk klp gdg cilincing koja https://t.co/QVDdkCSZql"
"19660","238","@PDI_Perjuangan https://t.co/LO4IxcFUcA"
"19661","238","kordinasi dan monitor genangan untuk segera disurutkan https://t.co/sgRjuj2Wn4"
"19662","238","kordinasi banjir subuh2 😅 semangat2 semoga ga banjir klp gdg cilincing koja dan seluruh jakarta dan kalau ada  gena… https://t.co/EEjxxJhuhI"
"19663","238","pompa apung dan posko biru siaga banjir https://t.co/Q5EW2RuK77"
"19664","238","mobile pump 20.000 Lps dan 60.000 Lps surutkan trus smoga ga banjir #wakilrakyat #cilincing #koja #kelapagading… https://t.co/eP8K1MNULY"
"19665","238","monitor pompa apung untuk surutkan genangan yg ada langsung https://t.co/eFKgFcHaCH"
"19666","238","monitor rupom jalan on dan standby untuk persiapan cuaca ekstreme jakut cilincing koja klp gdg https://t.co/VjvWRcruHd"
"19667","238","monitor pompa klp gdg timur https://t.co/qBkuTaqZr5"
"19668","238","Monitor pompa bgr https://t.co/gqooElW0TQ"
"19669","238","Monitor pompa mobile https://t.co/Bbc4E1B9vg"
"19670","238","monitor pompa on trus dan surutkan trus cikoding kali kresek mulai turun 🙏🏻 stay safe all #cilincing #koja… https://t.co/3y1XaOwJ6T"
"19671","238","gas terus , tambahan pompa artha mulai deras nyedotnya 🙏🏻 https://t.co/97AVfFdonq"
"19672","238","Pompa mobile tambahan utk bantu surutkan air trus pg2 mulai surut yaaa https://t.co/QKADa7jztW"
"19673","238","sidak pompa mobile di gdg hr ini krn kmren cuaca extreme kali tinggi dan bbrp luber dan genangan banjir https://t.co/mVVJVjtwd6"
"19674","238","Langsung Cek ke TKP Untuk Pompa Mobile , Ini Sdh Operasi Di bbrp tempat di artha , ada jg di VGI, RW 14 dan Apung J… https://t.co/tnlNRI8g9U"
"19675","238","semoga genangan cepat surut dan smua prangkat yg masih terbatas 😢 bisa menyurutkan genangan https://t.co/9IGbEsFyPp"
"19676","238","pompa mobile , pompa apung , rumah pompa semua dimaksimalkan #cikoding https://t.co/JRN47cZ9oS"
"19677","238","kordinasi di maksimalkan utk genangan cepat surut krn kmren malam sampai pagi cuaca extreme  @fpdip_jakarta https://t.co/YRYpP7bIKx"
"19678","238","Memperingati Hari Kanker Anak.
Jangan menyerah, nikmati hari-harimu dengan senyum dan tetaplah bersemangat. https://t.co/iWY1yKwd0u"
"19679","238","[ Latepost ]

Mendengarkan Ahli Tata Kota Dalam Pembahasan Raperda RDTR DPRD DKI Jakarta https://t.co/yAizL398EB"
"19680","238","Kordinasi pompa , waduk kolakan di klp gdg cilincing koja mulai hujan besar https://t.co/Lo6H3b3Ymz"
"19681","238","Dapet Angpao dari Pa Ahok hehehehe biar cepet merit 😂 tadi pas #ImlekanBarengBanteng Bersama @PDI_Perjuangan https://t.co/DDVm0Aaza5"
"19682","238","Selamat Tahun Baru Imlek 2572 ... GONG XI FA CAI https://t.co/fwqaq0iBjH"
"19683","238","RT @channel_jakarta: Tahun Baru Imlek Versi Tina Toon di Tengah Pandemi - https://t.co/oBD4rogeFM : Instagram @tinatoon101

IDN-CHANNEL - T…"
"19684","238","#ImlekanBarengBanteng https://t.co/CBuTLJsVsF"
"19685","238","Tindak Lanjut Laporan Warga , Jalanan Rusak dan Bolong di PG2 dan KGT Klp Gdg Akibat Hujan dan Genangan ... Trims K… https://t.co/50dJC119M1"
"19686","238","Tindak Lanjut Laporan Warga Jalanan Rusak Di Kelapa Gading Akibat Hujan dan Genangan Air Kmren , Yg Lain On Progres… https://t.co/McaC6ZqRoV"
"19687","238","setiap hujan kordinasi pompa , waduk , olakan dan saluran di klp gdg cilincing koja dan skitarnya https://t.co/0bwLDloJ8a"
"19688","238","Untuk jalanan di Kelapa Gading yang banyak bolong dan rusak sedang di kordinasikan dengan Kecamatan dan Bina Marga… https://t.co/8lyVStd0kM"
"19689","238","Sejumlah kegiatan SDA Cilincing, Koja, Kelapa Gading dalam Penanggulangan Banjir di Wilayah Kerukan Kali, Pembersih… https://t.co/miQD4ZHG6a"
"19690","238","RT @fpdip_jakarta: Sikap Fraksi PDI Perjuangan DKI Jakarta memutuskan menolak usulan perubahan RPJMD 2017-2020 karena patut diduga untuk me…"
"19691","238","Selamat Hari Pers Nasional,
Bangkit dari Pandemi, Jakarta gerbang Pembangunan Ekonomi, Bersama Pers sebagai Akselea… https://t.co/4jY48oVrqg"
"19692","238","pantauan tinggi pintu air dan pompa pagi ini 🙏🏻 https://t.co/VoVCAvCae3"
"19693","238","pompa jalan utk menyurutkan genangan dan penampungan https://t.co/QrmVDEWMU3"
"19694","238","penampungan jg sdh ditambahkan agar air ga stuck di sal phb 🙏🏻 semoga ga banjir dan genangan cepat surut https://t.co/po6FFs46Wb"
"19695","238","Laut posisi pasang mengakibatkan sulitnya aliran air deras ke laut tp kordinasi dgn sda utk pompa maksimal dan pomp… https://t.co/XXbzV1hJyb"
"19696","238","Kordinasi pantau banjir klp gading cilincing koja jakut krn hujan deras dan potensi kiriman air dr timur https://t.co/uN8DENP4Tn"
"19697","238","Memperingati Hari Kanker Sedunia,
Jangan pernah menyerah, yaakinlah bahwa setiap penyakit itu ada obatnya dan tetap… https://t.co/Eo8n6HFZyO"
"19698","238","Hai Guys di video kali ini aku mau share kondisi aku yang positif covid tapi cuma 2 hari, penasaran seperti apa?
Yu… https://t.co/zfWOm2S2Xy"
"19699","238","Mengikuti Pelaksanaan Musrenbang Tingkat Kecamatan tahun 2021 di wilayah Kelurahan Kalibaru dan Kelapa Gading Barat. https://t.co/rUI56Q7ztY"
"19700","238","yuhuuu setlah kordinasi dan tinjauan pompa klp gdg timur beres ... trims jg untuk jajaran sudin tata air jakut 👍🏻🙏🏻… https://t.co/VGE1VdEzlV"
"19701","238","Rapat Bapemperda DPRD Provinsi DKI Jakarta bersama komisi-komisi melalui zoom online tentang Revisi Perda RDTR. https://t.co/63l5waAajR"
"19702","238","Kordinasi dan Tindaklanjut Genangan Karena Hujan Deras di Cikoding .. Ada Genangan Yg Terus Menerus Krn Proyek Tol… https://t.co/aOulW8t3AG"
"19703","238","Kordinasi Penyurutan Genangan Air Lokasi Pegangsaan 2 Kec Klp Gdg Jakut 🙏🏻 Semangat Petugas Biru dan Orens di Punca… https://t.co/xiqcCcONQn"
"19704","238","Waspada Banjir Jakarta , Untuk Jakut Khususnya Klp Gdg Cilincing Koja , Pompa Sdh Beroperasi dan Sebagian Standby .… https://t.co/d3PhDrTNHr"
"19705","238","RT @fpdip_jakarta: Badan Meteorologi, Klimatologi, dan Geofisika (BMKG) memperingatkan status siaga banjir di DKI Jakarta hingga Jawa Barat…"
"19706","238","Terima Kasih Sudin SDA Jakarta Utara yang telah menerjunkan :
1. Satgas pasukan biru dalam melakukan kegiatan pengu… https://t.co/2YVddFZG8f"
"19707","238","Update Penanggulangan Banjir,

Kolam Olakan depan Mall Kelapa Gading sudah Rampung 6-7 Kolam dan Tinggal Finishing.… https://t.co/FYp4Odpatq"
"19708","238","Jadi air disedot terus ya guys &amp; pembersihan saluran &amp; sampah jalan terus.
Pompa Don Bosco yang 1 Down On Progress… https://t.co/xZeUL5p3zZ"
"19709","238","Update Penanganan dan Antisipasi Banjir Kelapa Gading.
Gerimis-gerimis manja di Gading tapi takut Hujan besar lagi… https://t.co/LsE1ZjFAI2"
"19710","238","(Kerusakan Saluran Ini (Disebabkan Pembangunan Tol) Yang Menjadi Penyebab Utama Seringnya Terjadi Genangan Banjir Ketika Hujan Besar)."
"19711","238","Update Banjir &amp; Tindak Lanjut Permohonan Warga,
Terus Kordinasi dan Monitor Pembangunan Saluran Precast Kelapa Gadi… https://t.co/nMkBerezx1"
"19712","238","Baru saja mengirim foto https://t.co/rRkRZHncwY"
"19713","238","Baru saja mengirim foto https://t.co/zzhBFQ4IYH"
"19714","238","Baru saja mengirim foto https://t.co/2D1hW2GNaV"
"19715","238","Baru saja mengirim foto https://t.co/VUY5uMbl1q"
"19716","238","Baru saja mengirim foto https://t.co/cnz0TuzCue"
"19717","238","Baru saja mengirim foto https://t.co/70NSn1xeUu"
"19718","238","Baru saja mengirim foto https://t.co/jLhZEXIxmR"
"19719","238","Pompa BGR - 4000 Air 250 Lumpur.
Tarik Air Kelapa Nias &amp; Sport Mall Kelapa Gading Barat Buang Ke Kali Sunter.… https://t.co/NXimyPZAA8"
"19720","238","Baru saja mengirim foto https://t.co/FS4KxcT5Kt"
"19721","238","Baru saja mengirim foto https://t.co/dcBP7n0zzy"
"19722","238","Baru saja mengirim foto https://t.co/fGITPF888H"
"19723","238","Baru saja mengirim foto https://t.co/4JquLpFGZL"
"19724","238","Dirgahayu PDI Perjuangan ke-48.
Tetap bergotong-royong untuk merawat dan mencintai Kebudayaan dan Alam Nusantara ki… https://t.co/V69wpAsSlQ"
"19725","238","Baru saja mengirim foto https://t.co/s4I0PUvN8l"
"19726","238","Hari ini mengikuti Bimtek HUT PDI Perjuangan ke-48.
Merdeka!!!

@pdiperjuangan 
@sekjenpdiperjuangan… https://t.co/UPNPVfUrwP"
"19727","238","Melakukan Registrasi Bimtek HUT PDI Perjuangan ke-48.

#hutpdiperjuangan48tahun 
#pdiperjuangan https://t.co/cecgRXL7jz"
"19728","238","Baru saja mengirim video https://t.co/s4EjDeY0Lt"
"19729","238","Baru saja mengirim foto https://t.co/Dwn4pZoXfr"
